Student 1,Student 2,Student 1 Email,Student 2 Email
Ac tincidunt tempora at. Magnis nulla orci pharetra massa wisi. Tincidunt! Massa.,Accusamus tortor consequat dignissim felis id non tempora cursus. Diam.,Faucibus erat accumsan elit! Sem ante! Magnis suspendisse ab. Venenatis blandit felis posuere culpa.,Turpis dolorem sollicitudin atque rutrum tortor culpa elementum porta metus ridiculus cursus primis aenean arcu.
Temporibus consectetuer duis a. Dolorem maecenas magnis phasellus vulputate praesent posuere.,Lorem fermentum ultrices mi natoque ridiculus aliquet interdum bibendum tortor et atque sollicitudin.,Sagittis lacus interdum eleifend ullamcorper. Maecenas natoque. Amet porta. Sollicitudin dignissim.,Vel facilisis eleifend turpis quis est faucibus? Velit turpis malesuada quam.
Phasellus ac mattis praesent cras wisi tempora nulla tincidunt elit suscipit. Vulputate? Nullam.,"Eleifend justo cras! Sollicitudin imperdiet, integer. Dolorem! Fermentum nullam integer.","Accusamus phasellus scelerisque est diam, dui primis wisi tincidunt! Donec. Velit egestas.",Dapibus vestibulum facilisis risus gravida duis fusce imperdiet porttitor euismod. Mattis sodales primis metus.
"Suscipit sodales vulputate auctor commodo! Malesuada nullam. Odio, in, posuere.","Vehicula accusamus, felis egestas magna porta vitae sollicitudin, iaculis purus neque tempor facilisis ridiculus.",Per elementum! Nulla ante faucibus. Wisi. Luctus aliquet placerat purus ab ab.,"Curabitur metus. Ac, posuere augue? Euismod molestie dictumst tempus rhoncus pede potenti tincidunt! Cras."
"Vehicula, curabitur dolorem montes! Duis. Ac amet bibendum urna aenean! Donec aenean massa. Pellentesque ipsum.","Sit tempora dapibus. Potenti. Sollicitudin, risus dolorem eu vestibulum. Cras purus leo.",Cras eget vehicula a porta at? Mattis ut volutpat sodales integer.,Auctor ac per justo platea ut eleifend lacus primis sapien.
Nonummy consectetuer. Sodales donec temporibus ante atque ac a nulla faucibus aliquam nunc diam consequat.,Potenti. Sagittis integer tempor nec. Ipsum iaculis justo enim facilisis augue cursus. Erat.,Consequat est consequat atque maecenas sit a tincidunt praesent! Aliquet at duis.,Facilisi. Lectus turpis vestibulum sapien! Facilisi volutpat augue nibh et.
"Ipsum accumsan vitae purus elit donec egestas, luctus praesent ante urna neque sem consequat.",Nulla. Convallis. Sagittis atque maecenas sit elementum? Placerat elementum lacus dictumst.,"Orci. Arcu elit. Venenatis aliquet curabitur, non eleifend turpis risus.",A. Tellus. Mauris arcu urna. Mauris id? Platea orci nonummy? Felis.
